{
  "schema": "sens-benchmark-manifest/v1",
  "stand": "core-math-generated-identity",
  "wing": "Core and proof-oriented research",
  "roles": [
    "RESEARCH",
    "FALSIFIER"
  ],
  "question": "What bounded observation does the existing benchmarks/core-math-generated-identity/run.py witness provide for Core Math Generated Identity, and what counterexample limits the conclusion?",
  "claim": "Metadata-only backfill. Adding this record does not replay the runner, create a benchmark result, raise evidence strength, ratify a semantic identity, or grant production authority. Interpret any prior result only with its own exact SHA, raw witness and declared limits.",
  "witness": [
    "benchmarks/core-math-generated-identity/run.py"
  ],
  "status": "METADATA-BACKFILL; NOT REPLAYED BY THIS CHANGE",
  "generation": "unknown",
  "axis": "research/backfill/core-math-generated-identity",
  "reproduce": "python3 benchmarks/core-math-generated-identity/run.py"
}
