{
  "schema": "sens-benchmark-manifest/v1",
  "stand": "sens-performance",
  "wing": "Implementation and physical-cost research",
  "roles": [
    "RESEARCH",
    "FALSIFIER"
  ],
  "question": "What bounded observation does the existing benchmarks/sens-performance/adaptive_carrier_bench.py witness provide for Sens Performance, and what counterexample limits the conclusion?",
  "claim": "Metadata-only backfill. Adding this record does not replay the runner, create a benchmark result, raise evidence strength, ratify a semantic identity, or grant production authority. Interpret any prior result only with its own exact SHA, raw witness and declared limits.",
  "witness": [
    "benchmarks/sens-performance/adaptive_carrier_bench.py"
  ],
  "status": "METADATA-BACKFILL; NOT REPLAYED BY THIS CHANGE",
  "generation": "unknown",
  "axis": "research/backfill/sens-performance",
  "reproduce": "python3 benchmarks/sens-performance/adaptive_carrier_bench.py"
}
