{
  "schema": "sens-benchmark-manifest/v1",
  "stand": "physical-reality",
  "wing": "Native physical T5 execution (Rust mechanism)",
  "roles": [
    "MEASUREMENT",
    "CONFORMANCE"
  ],
  "question": "What are the physical byte sizes and cold-process latencies of committed T5 SENS programs after the native CLIs agree on output?",
  "claim": "The native Rust integration benchmark checks eight committed physical T5 fixtures against their extensionless views and requires byte-identical stdout from sens and sens-trit before measuring cold-process latency. These are mechanism observations, not independent semantic laws or cross-language ranking. Historical Python measurements are not current evidence.",
  "witness": [
    "crates/sens-cli/tests/physical_sens_runtime_benchmark.rs",
    ".github/workflows/sens-performance.yml",
    "scripts/prove-lisp-semantic-t5m.sh"
  ],
  "status": "NATIVE-HARNESS-COMMITTED; MANUAL-REPLAY-NOT-YET-RECORDED",
  "generation": "2026-10-23; no fresh measurement values asserted by this commit",
  "axis": "physical-t5/cold-process-output-parity-and-latency",
  "reproduce": "Manual: gh workflow run sens-performance.yml --ref main; current runner emits TSV evidence"
}
