{
  "schema": "sens-benchmark-manifest/v1",
  "stand": "lisp15-numeric-predicate-factor",
  "wing": "Domain-law and semantic research",
  "roles": [
    "RESEARCH",
    "FALSIFIER"
  ],
  "question": "What bounded observation does the existing benchmarks/lisp15-numeric-predicate-factor/run.py witness provide for Lisp15 Numeric Predicate Factor, and what counterexample limits the conclusion?",
  "claim": "Metadata-only backfill. Adding this record does not replay the runner, create a benchmark result, raise evidence strength, ratify a semantic identity, or grant production authority. Interpret any prior result only with its own exact SHA, raw witness and declared limits.",
  "witness": [
    "benchmarks/lisp15-numeric-predicate-factor/run.py"
  ],
  "status": "METADATA-BACKFILL; NOT REPLAYED BY THIS CHANGE",
  "generation": "unknown",
  "axis": "research/backfill/lisp15-numeric-predicate-factor",
  "reproduce": "python3 benchmarks/lisp15-numeric-predicate-factor/run.py"
}
