{
  "schema": "sens-benchmark-manifest/v1",
  "stand": "d4-cleanroom-parent-law",
  "wing": "Domain-law and semantic research",
  "roles": [
    "RESEARCH",
    "FALSIFIER"
  ],
  "question": "What bounded observation does the existing benchmarks/d4-cleanroom-parent-law/run.py witness provide for D4 Cleanroom Parent Law, and what counterexample limits the conclusion?",
  "claim": "Metadata-only backfill. Adding this record does not replay the runner, create a benchmark result, raise evidence strength, ratify a semantic identity, or grant production authority. Interpret any prior result only with its own exact SHA, raw witness and declared limits.",
  "witness": [
    "benchmarks/d4-cleanroom-parent-law/run.py"
  ],
  "status": "METADATA-BACKFILL; NOT REPLAYED BY THIS CHANGE",
  "generation": "unknown",
  "axis": "research/backfill/d4-cleanroom-parent-law",
  "reproduce": "python3 benchmarks/d4-cleanroom-parent-law/run.py"
}
