{
  "schema": "sens-benchmark-manifest/v1",
  "stand": "cachegrind-join",
  "wing": "Implementation and physical-cost research",
  "roles": [
    "RESEARCH",
    "FALSIFIER"
  ],
  "question": "What bounded observation does the existing benchmarks/cachegrind-join/join_cachegrind.py witness provide for Cachegrind Join, and what counterexample limits the conclusion?",
  "claim": "Metadata-only backfill. Adding this record does not replay the runner, create a benchmark result, raise evidence strength, ratify a semantic identity, or grant production authority. Interpret any prior result only with its own exact SHA, raw witness and declared limits.",
  "witness": [
    "benchmarks/cachegrind-join/README.md",
    "benchmarks/cachegrind-join/join_cachegrind.py"
  ],
  "status": "METADATA-BACKFILL; NOT REPLAYED BY THIS CHANGE",
  "generation": "unknown",
  "axis": "research/backfill/cachegrind-join",
  "reproduce": "python3 benchmarks/cachegrind-join/join_cachegrind.py"
}
