{
  "schema": "sens-benchmark-manifest/v1",
  "stand": "domain-graph-pressure",
  "wing": "SENS bounded research",
  "roles": [
    "RESEARCH",
    "FALSIFIER"
  ],
  "question": "What bounded observation does the existing benchmarks/domain-graph-pressure/run.py witness provide for Domain Graph Pressure, and what counterexample limits the conclusion?",
  "claim": "Metadata-only backfill. Adding this record does not replay the runner, create a benchmark result, raise evidence strength, ratify a semantic identity, or grant production authority. Interpret any prior result only with its own exact SHA, raw witness and declared limits.",
  "witness": [
    "benchmarks/domain-graph-pressure/README.md",
    "benchmarks/domain-graph-pressure/run.py"
  ],
  "status": "METADATA-BACKFILL; NOT REPLAYED BY THIS CHANGE",
  "generation": "unknown",
  "axis": "research/backfill/domain-graph-pressure",
  "reproduce": "python3 benchmarks/domain-graph-pressure/run.py"
}
