{
  "schema": "sens-benchmark-manifest/v1",
  "stand": "physical-binary-performance",
  "wing": "Physical T5 runtime and transport",
  "roles": [
    "MEASUREMENT",
    "CONFORMANCE"
  ],
  "question": "How large and fast is current physical .sens T5 transport, decode/open, and pure execution when committed T5 files are re-encoded from their canonical exact-width word projections?",
  "claim": "Measures canonical word-projection-to-T5 re-encoding, physical file size, and per-process wall startup+execution, p95 and optional Cachegrind I refs across eight existing physical T5 fixtures. The reference Python decoder creates a temporary exact-width word projection from each committed .sens file; the Rust encoder must reproduce the committed bytes, and two CLI execution paths must emit identical output. This does not measure Lisp AST lowering or establish an independent semantic oracle, in-process warm throughput, or cross-machine superiority.",
  "witness": [
    "README.md",
    "run.py"
  ],
  "status": "ACTIVE-PHYSICAL-T5-ROUNDTRIP-MEASUREMENT",
  "generation": "2026-10-12 canonical word projection from committed T5 artifacts",
  "axis": "sens/t5-physical-runtime-density",
  "reproduce": "cargo build --locked --release -p sens-cli --bin sens --bin sens-trit && python3 benchmarks/physical-binary-performance/run.py --sens target/release/sens --sens-trit target/release/sens-trit --reps 21 --warmup 4 --out /tmp/sens-physical-bench"
}
