{
  "schema": "sens-benchmark-manifest/v1",
  "stand": "context-carrier",
  "wing": "Core-Math / proof-context carrier research",
  "roles": [
    "RESEARCH",
    "FALSIFIER"
  ],
  "question": "Which context carrier preserves the order, multiplicity, witness identity, and provenance needed by the declared support/refutation workloads?",
  "claim": "Capability matrix and bounded logical counters only; wall time is diagnostic, and carriers unable to preserve required information are non-comparable rather than winners.",
  "witness": [
    "README.md",
    "run.py"
  ],
  "status": "RESEARCH-ONLY; SMOKE PROFILE; METADATA BACKFILL",
  "generation": "unknown",
  "axis": "capability preservation / logical reads-writes / invalidation fanout",
  "reproduce": "python3 benchmarks/context-carrier/run.py --smoke --out /tmp/sens-context-carrier/results"
}
